{
  "schemaVersion": "0.1",
  "status": "private-provisional-unpublished",
  "standardVersions": ["0.1.0-rc.1"],
  "envelopeVersions": ["0.1"],
  "operations": [{ "version": "1", "id": "validate-overlay@1", "aasIdentity": "aas:v0:sha256:7777777777777777777777777777777777777777777777777777777777777777" }],
  "profiles": [],
  "limits": { "maxInputBytes": 1048576, "maxDepth": 64, "maxPathSegments": 64, "maxPathBytes": 4096, "maxEntries": 10000, "maxLogicalBytes": 10485760, "maxReadBytes": 10485760, "maxPerEntryBytes": 1048576, "maxOverlayOperations": 1000, "maxTargets": 1000, "maxEvidenceReferences": 10000, "maxExtensionBytes": 65536, "maxDiagnostics": 10000, "maxOutputBytes": 1048576, "maxConcurrency": 8, "maxTotalWork": 1000000 },
  "extensions": {},
  "criticalExtensions": {}
}
